,publish_date,scraped_date,title,text,Companies,Country,link,Comments,update
86,Date,13-10-2022,"Socar S Ipo Price Set At 28,000 Won, Much Lower Than Hoped, Amid Weak Demand","South Korea S Largest Car Sharing Platform Operator Socar Inc Said Tuesday Its Initial Public Offering Ipo Price Has Been Set At 28,000 Won Us 21 44 Per Share, Which Is Much Lower Than The Price Range It Had Hoped For Amid Apparently Weak Demand The Price Was Determined After Socar Conducted A Two Day Demand Forecasting From Domestic And Foreign Institutional Investors That Ended Friday It Was Below The Lower Bound Of Its Target Price Ranging From 34,000 Won To 45,000 Won Despite The Disappointing Price Setting, The Company Decided To Go Ahead With The Ipo Slated For Later This Month It Is Pushing To Sell A Total Of 3 64 Million New Shares With A Plan To Raise 101 92 Billion Won Of The Total New Shares That It Will Offer, 910,000 Shares, Or 25 Percent, Will Be Sold To Retail Investors Via Subscription That Will Be Held Wednesday And Thursday In Consideration Of The Investors Voice And Opinion, We Decided To Offer Our Stocks In An Investor Friendly Manner, Socar Chief Executive Park Jae Wook Said There Are Concerns That The Price Band Socar Had Hoped For May Have Been Overpriced, Considering Unfavorable Market Conditions, Including Investors Reduced Appetite For Risky Assets Global Monetary Tightening Aimed At Taming Inflation Has Also Weighed On The Stock Markets Socar Has Voiced Confidence That It Will Successfully Complete The Planned Ipo, Citing Its Stellar Performance In The Car Sharing Market In Recent Years With The Proceeds From The Ipo, Socar Plans To Increase Its Presence In The Mobility Market, Expand Investment In Technology And Buy Promising Mobility Firms In A Related Move, The Company Plans Within This Year To Launch A Super App That Combines The Existing Car Sharing Services With Micromobility, Such As Electric Bicycles, And Platform Based Parking Services Also In The Second Half Of This Year, It Will Test Provide A Large Scale Vehicle Management Solution To Leading Logistics Giants, Such As Hyundai Glovis Co And Lotte Global Logistics Co Source Yonhap News Agency"," Socar Inc , Socar, Ipo, Socar, Ipo, Socar, Hyundai Glovis Co , Lotte Global Logistics Co , Yonhap News Agency , Socar ", ,https://www.koreanewsgazette.com/socars-ipo-price-set-at-28000-won-much-lower-than-hoped-amid-weak-demand/, , 
87,Date,13-10-2022,Car Sharing Firm Socar Confident Of Successful Ipo,"Seoul South Korea S Largest Car Sharing And Mobility Service Provider Socar Inc On Wednesday Said That Its Planned Initial Public Offering Ipo Will Be Successful Despite Unfavorable Market Conditions Socar, Established In 2011, Is Seeking To Make A Market Debut Later This Month After Going Through Ipo Subscription Thursday And Friday This Week From Institutional Investors And Wednesday And Thursday Next Week From Retail Investors It Wants The Ipo Price To Be Set At Between 34,000 Won Us 25 60 And 45,000 Won, Which Will Help The Car Sharing Service Provider Raise Up To 205 Billion Won Its Market Cap After The Ipo Will Range From 1 2 Trillion Won To 1 6 Trillion Won Socar Said Its Stellar Performance In The Car Sharing Market Will Help Make Its Ipo Successful Although The Local Ipo Market Has Been Chilly In The Face Of Monetary Tightening And A Looming Economic Recession We Are Confident About Socar S Performance This Year And Next Year, Both In Expansion And Profitability, Socar Ceo Park Jae Wook Said In A Press Meeting We Are Not Sure Exactly How Long This Upward Momentum In The Car Sharing Service Market Will Last, But We Cannot Miss This Opportune Moment It Is Better To Seek Ways To Fly High With The Raised Funds, He Added Park Said Socar S Earnings Will Be Able To Shift To The Black, Backed By Its 79 Percent Market Share And Brand Awareness That Will Reduce Its Marketing Costs Thanks To The Flourishing Single Person Households, People Are Becoming Increasingly Open To Car Sharing, Park Said According To Socar Data, 64 Percent Of Its Clients Are Returning Customers, And More Than 50 Percent Of Its Users Wish To Keep Using Their Socar Plans Or Delay Purchases For New Cars It Holds Some 19,000 Cars For Its Service Across The Country Its Sales Spiked 31 Percent On Year To 289 Billion Won Last Year, But It Suffered An Operating Loss Of 21 Billion Won Socar Plans To Spend The Proceeds From The Ipo To Raise Its Presence In The Mobility Market With Investment In Technology And The Acquisition Of Promising Mobility Firms Within This Year, The Company Plans To Launch A Super App That Combines The Existing Car Sharing Services With Micro Mobility, Such As Electric Bicycles, And Platform Based Parking Services Also In The Second Half Of This Year, It Will Test Provide A Large Scale Vehicle Management Solution To Leading Logistics Giants, Such As Hyundai Glovis Co And Lotte Global Logistics Co Last Year, It Bought A 100 Percent Stake Of Nine2One Inc , Operator Of E Bike Sharing Service Elecle, And Acquired Online Parking Platform Service Modu Co Via A Share Swap Source Yonhap News Agency"," Socar Inc , Ipo, Ipo, Ipo, Socar, Socar, Park, Socar, Socar, Hyundai Glovis Co , Lotte Global Logistics Co , Nine2One Inc , Modu Co , Yonhap News Agency , Socar, Ipo ", ,https://www.koreanewsgazette.com/car-sharing-firm-socar-confident-of-successful-ipo/, , 
88,Date,13-10-2022,Korea Exchange To Review Kyobo Life S Ipo Bid,"Seoul Kyobo Life Insurance Co On Thursday Said The Country S Bourse Operator Will Begin A Preliminary Assessment Of Its Initial Public Offering Ipo The Korea Exchange Krx Has Said It Will Launch A Panel To Review The Ipo Bid Of South Korea S No 2 Life Insurer Eight Months After Its Filing Kyobo Life Has Been Pushing To Go Public Since 2018, But Opposition From Its Shareholders Has Halted The Process For Years Kyobo Life Chairman And The Largest Stakeholder Shin Chang Jae, As Well As Those With Special Interests In The Company, Hold A Combined 36 9 Percent Stake If The Ipo Is Successful, Kyobo Life Will Begin Preparing For The Introduction Of A New Accounting Rule For Insurance Products In 2023 Source Yonhap News Agency"," Kyobo Life Insurance Co , The Korea Exchange, Krx, Kyobo Life, Kyobo Life, Ipo, Kyobo Life, Yonhap News Agency , Korea Exchange, Kyobo Life S ", ,https://www.koreanewsgazette.com/korea-exchange-to-review-kyobo-lifes-ipo-bid/, , 
89,Date,13-10-2022,One Store Scraps Ipo Plan Due To Weak Investor Confidence Sources,"Seoul One Store Co , A South Korean Mobile App Market Platform, Decided Wednesday To Withdraw Its Plans For An Initial Public Offering Ipo Due To Lackluster Investor Confidence, Financial Industry Sources Said The No 2 Mobile App Market Operator Here, After Google Play Store, Received Lackluster Response From Institutional Investors During A Two Day Demand Forecasting Session Until Tuesday, According To The Sources Institutional Bids Reportedly Mostly Fell Below The Company S Desired Pricing Band Between 34,300 Won 27 And 41,700 Won Just This Morning, One Store Considered Going Public By Lowering The Desired Price, But They Apparently Decided To Scrap The Plan After Concluding The Company S Value May Not Be Properly Recognized By The Market Under The Current Stock Market Situation, A Source Said One Store S Affiliate Sk Shieldus Also Nixed Its Ipo Plan Last Week Due To Weak Investor Sentiment Lee Jae Hwan, Ceo Of One Store, Said In A Press Conference On Monday That The Company Was Determined To Get Listed On The Main Bourse As Planned This Month, Undeterred By The Sister Company S Derailed Attempt One Store Is The Latest Among Several South Korean Companies That Have Backpedaled On Ipo Plans So Far This Year In Late January, Hyundai Engineering Co , The Construction Arm Of Hyundai Motor Group, Withdrew Its Plan To Get Its Stocks Listed On The Country S Main Bourse Due To Adverse Market Conditions One Store Logged 214 Billion Won In Sales Last Year And An Operating Loss Of 5 8 Billion Won The Company Racked Up 1 13 Trillion Won Worth Of Transactions On Its Platform Last Year Its Market Share In The Local Mobile App Market Stands At Some 14 Percent, With Google Play S Presence Coming In At 71 9 Percent Source Yonhap News Agency"," Hyundai Engineering Co , Hyundai Motor Group, Google Play S, Yonhap News Agency , ", ,https://www.koreanewsgazette.com/one-store-scraps-ipo-plan-due-to-weak-investor-confidence-sources/, , 
90,Date,13-10-2022,Sk Shieldus Eyes Raising Up To 3 55 Tln Won Through Ipo Next Month,"Seoul Sk Shieldus Co , A Security Arm Of South Korean Telecom Giant Sk Telecom Co , Is Expected To Raise Up To 3 55 Trillion Won Us 2 85 Billion Through A Planned Initial Public Offering Ipo Next Month The Listing, Set For May 19, Will Mark The Biggest Ever Market Debut By A Security Service Provider, More Than The Value Of Its Rival Firm S 1 Corp , A Security Firm Under Samsung Group Our Company Integrated Cybersecurity And Physical Security Services Sk Shieldus Should Not Be Compared With S 1 By One To One, Ceo Park Jin Hyo Said At An Online Conference Sk Shieldus, Which Changed Its Name From Adt Caps Co Last October, Currently Provides Security Services Across Four Main Categories Cybersecurity, Convergence Security, Physical Security, And Safety And Care Last Year, The Company Reported 1 55 Trillion Won In Sales, Trailing Behind 2 31 Trillion Won Recorded By S 1 Park Said The Company Aims To Take Over Other Security Companies With Higher Technical Skills Following The Ipo, And Hire More Personnel With Expertise In Platform Sk Shieldus Said It Set The Ipo Price Range Of 31,000 38,800 Won Credit Suisse, The Lead Bookrunner, Morgan Stanley, Kb Securities And Nh Investment And Securities Began Taking Orders From Investors Demand Forecasting For Domestic Institutions Is Slated For May 3 And May 4, With That For Retail Investors Set To Take Place On May 9 And May 10 Source Yonhap News Agency"," Sk Shieldus Co , Sk Telecom Co , Ipo, S 1 Corp , Samsung Group, Adt Caps Co , Ipo, Credit Suisse, Morgan Stanley, Kb Securities And Nh Investment, Yonhap News Agency , Ipo ", ,https://www.koreanewsgazette.com/sk-shieldus-eyes-raising-up-to-3-55-tln-won-through-ipo-next-month/, , 
91,Date,13-10-2022,Sk On S Ipo Unlikely To Take Place Until After 2025 Sk Innovation Ceo,"Seoul Sk On Co Is Not Considering An Initial Public Offering Ipo For At Least Another Two To Three Years But Will Build Up Its Competitiveness And Enhance Corporate Value Before Pushing For A Market Debut, Head Of Its Parent Company Said Thursday The Potential Listing Of Sk On Has Drawn Attention Since The Battery Unit Was Spun Off From Sk Innovation In October Last Year, As Part Of Sk S Push To Bolster The Battery Business Amid Growing Demand From Global Automakers Vying For A Bigger Share In The Electric Vehicle Market What S The Most Important For An Ipo To Take Place Is That We Need To Have Our Battery Business Recognized In The Market, Kim Jun, Ceo And Vice Chairman Of Sk Innovation Co , Told Reporters After A General Shareholders Meeting I Expect That We Should Be Able To Deliver The Performance, In Terms Of Sales, Profitability And Stable Management Of Equipment, After 2025, And I Believe It Would Be After 2025 If We Were To Do An Ipo, He Said Its Bigger Rival, Lg Energy Solution Ltd , Set A Record Ipo In January That Made The Battery Maker The Second Largest Company In South Korea By Market Cap, Reflecting The Global Electrification Trend Kim Said Sk On Is At The Pre Ipo Stage To Raise Funds From Investors In Advance Of Going Public We Need Large Scale Resources As We Are Continuing With The Facility Expansion We Plan To Sign The Contracts On The Investments In The First Half, Kim Said Industry Sources Predict Sk On Is Seeking To Raise Between 3 And 5 Trillion Won Us 2 47 4 12 Billion , Which Amounts To About A 10 Percent Stake In The Company Kim Forecast Sk On Will Swing To The Black In The Fourth Quarter Of This Year And Achieve An Annual Surplus From Next Year Sk Innovation S Battery Business Logged An Operating Loss Of 683 1 Billion Won In The Fourth Quarter Of Last Year In Light Of Any Possible Advance Into New Businesses, Kim Said He Is Looking At Areas Of Non Carbon, Or Low Carbon Energy Sources, And Discussing Various Ideas With Sk Group Chairman Chey Tae Won, Without Elaborating Further Earlier This Month, Chey Hinted At Drawing Up A New Business Map That Incorporates Energy And Environment During A Visit To A Sk Innovation Factory In A Southwestern City Source Yonhap News Agency"," Sk Innovation, Sk Innovation Co , Lg Energy Solution Ltd , Sk Innovation S, Sk Group, Sk Innovation, Yonhap News Agency , ", ,https://www.koreanewsgazette.com/sk-ons-ipo-unlikely-to-take-place-until-after-2025-sk-innovation-ceo/, , 
92,Date,13-10-2022,"Money Raised Through Ipos Hits Record High In 2021 Amid Ample Liquidity, Bullish Sentiment","Seoul The Amount Of Money South Korean Firms Raised Through Initial Public Offerings Ipos More Than Quadrupled To Hit A Record High Last Year Thanks To Ample Liquidity And The Overall Bullish Stock Market Sentiment, Data Showed Monday A Total Of 89 Companies Went Public In 2021 By Listing Stocks On The Benchmark Kospi And Secondary Tech Heavy Kosdaq Markets And Raised A Combined 19 7 Trillion Won Us 16 4 Billion , According To The Data From The Financial Supervisory Service The Money Raised From Ipos Represented A 333 9 Percent Surge From 4 5 Trillion Won A Year Earlier, The Data Showed The Number Of Companies Whose Shares Listed On The Stock Markets For The First Time Also Jumped From The Previous Year S 70 The Ipo Market Was Driven By The Overall Rise In Local Stock Markets And Ample Liquidity Injected Into The Economy Bolstered By Low Borrowing Costs In Line With Record Low Policy Rates Intended To Boost The Pandemic Hit Economy Investors Got More Interested In New Stock Listings, With The Competition Ratio For Ipo Stocks Jumping To An Average Of 1,136 To 1 Last Year, Up From The 956 To 1 Ratio A Year Earlier The Prices Of Newly Listed Stocks Closed 57 4 Percent Higher On Average On Their First Trading Day, Compared With Their Ipo Prices The Return Marked The Highest In Five Years, The Data Showed Their Average Prices Also Jumped 54 8 Percent At The End Of Last Year From The Ipo Prices But Of The Companies That Went Private, 28 Firms, Or 31 5 Percent, Saw Their Stocks Fall Below The Ipo Prices At The End Of Last Year, The Data Showed Source Yonhap News Agency"," Kospi, Kosdaq, The Financial Supervisory Service, Yonhap News Agency , ", ,https://www.koreanewsgazette.com/money-raised-through-ipos-hits-record-high-in-2021-amid-ample-liquidity-bullish-sentiment/, , 
93,Date,2022-10-13 03:36:38.939977,War In Ukraine Threatens India S Blockbuster Ipo,India S Behemoth State Owned Insurer Lic Is All Set To Go Public With An Initial Public Offering That Is Billed To Be The Biggest Ever In India But Russia S Invasion Of Ukraine Has Raised Questions About The Timing ," Lic , ", ,https://www.dw.com/en/war-in-ukraine-threatens-indias-blockbuster-ipo/a-61038089, , 
94,Date,2022-10-13 03:36:41.069252,Porsche Will Go Public Before The End Of 2022 Vw,Volkswagen Has Given The Greenlight For Subsidiary Porsche To Be Listed On The Stock Exchange The Ipo Could Be One Of The Biggest In German History ," Volkswagen, Porsche, Ipo , Porsche ", ,https://www.dw.com/en/porsche-will-go-public-before-the-end-of-2022-vw/a-63026586, , 
95,Date,2022-10-13," Kakao Bank, Krafton Employees Feel Pain Of Bear Market "," A Kakaobank Logo Is Seen Next To A Kakao Friends Character Kakaobank Amid The White Hot Stock Rally Of 2021, They Were The Envy Of All Those Working At The Year S Biggest Market Debutants Krafton And Kakao Bank Were Given Chances To Buy Stocks In Their Company At A Set Price, Via Employee Share Ownership Plans However, None Of Those Who Bought The Employee Stocks Are Seeing Profits Now, As The Shares Are Currently Trading At Less Than Half The Price They Paid On Blind, An Anonymous Workplace Community App, A Verified Kakao Bank Employee Revealed A Loss Of 400 Million Won 280,164 In His Employee Stock Investment Kakao Bank Workers Are At Risk Of Becoming Credit Delinquents, The User Wrote People At The Company Borrowed Every Single Penny From Friends And Family Members To Buy As Many Employer Stocks As Possible Because We Were So Certain About The Stock S Return Prospects Another Post Spoke Of How The Office Atmosphere Has Recently Gone From Cheerful Around The Time Of Its Initial Public Offering Last Year To Gloomy Kakao Bank, A Mobile Banking Arm Of Kakao, Made Last Year S Second Biggest Ipo, Raising 2 55 Trillion Won On Its August, 2021 Listing On Korea S Main Kospi Bourse Shares Of The Company Closed At 17,750 Won On Wednesday, Less Than Half Of The Ipo Price Of 39,000 Won Kakao Bank Employees Have Purchased 12 74 Million Shares, Some 19 5 Percent Of The Total Offerings This Translates Into An Average Of 12,500 Shares Per Employee, Worth 490 Million Won At The Time Of Purchase The Situation At Krafton Appears To Be Similar Its Once Envied Employee Share Ownership Plan Has Turned Into A Nightmare Krafton Was The Star Of Last Year S Ipo Market, Raising A Whopping 4 3 Trillion Won In August It Was The Biggest Share Listing In Korea Last Year And The Second Biggest In The Country S Capital Market History Employees At The Game Firm Have Acquired 4 1 Percent Of The Total Offer, Or 351,525 Shares, At 498,000 Won Apiece This Translates Into An Average Of 264 Shares Per Employee And A Per Capita Investment Of 131 47 Million Won Krafton S Stock Closed At 180,500 Won Wednesday, Sharply Down From The Ipo Price Both Kakao Bank And Krafton Employee Stockholders Were Not Able To Divest Their Investments While They Were Making Profit Due To A One Year Lock Up Kakao Bank Stock Recorded An All Time High Of 94,400 Won On Aug 20, 2021, Soon After The Listing Krafton Stocks Peaked At 580,000 On Nov 17, 2021 The Lock Up Period Expired In August This Year For Both The Loss Is Only On Paper, Unless Realized But Employees Who Have Used Leverage For The Investment Are Left With A Choice Between Two Undesirable Options Selling With A Great Loss Or Enduring The Time Of Rising Interest Rates In Hope Of A Turnaround One Day Worse Off Are Those Who Have Taken On Securities Based Loans As The Value Of The Equity Continues To Fall, They Face Forced Liquidation To Avoid That, Additional Collateral Must Be Provided On Oct 7, Kakao Bank Ceo Yoon Ho Young Said The Company Would Review A Set Of Shareholder Return Policies, Including Buybacks We Will Actively Review Shareholder Return Policies, Such As Share Buyback Or Share Retirement, By The Time The 2022 Account Settlement Is Approved At A Shareholder Meeting, Yoon Said In An Internal Message Sent To Employees Early This Year, Krafton Founder And Board Chairman Chang Byung Gyu Reportedly Spent 30 Billion Won Buying Company Stocks In What Appears To Be A Failed Attempt To Help Boost Their Market Value On Wednesday, Korea Investment Securities Slashed Its Target Price For Krafton Shares To 270,000 Won Per Share The Same Brokerage Had Suggested 580,000 Won For The Stock In August 2021 By Park Han Na Hnpark Heraldcorp Com "," Kakaobank, Kakao Bank, Kakao Bank, Kakao Bank, Kakao Bank, Ipo, Kospi, Kakao Bank, Kakao Bank, Krafton, Kakao Bank, Krafton, Kakao Bank Ceo Yoon, Krafton, Korea Investment Securities, Krafton , ", ,http://www.koreaherald.com//view.php?ud=20221012000679&ACE_SEARCH=1, , 
96,Date,2022-10-13, Kurly S Ipo Plan To Be Decided Next Week ,"The Corporate Logo Of Kurly Kurly The Long Awaited Market Debut Of Kurly, Operator Of South Korean E Commerce Platform Market Kurly, Is Expected To Be Decided Soon As The Nation S Bourse Operator Is Scheduled To Hold A Final Review Session Next Week, According To Industry Sources On Tuesday If The Company Gets A Green Light From The Korea Exchange During The Session, It Is Ready To Go Public Following A Book Building Process, Its Share Price Will Be Decided The Issue Is Investor Sentiment Amid A Lukewarm Initial Public Offering Market This Year A Kurly Official Told The Korea Herald That It Is Too Early To Tell Whether The Company Should Consider Withdrawing Its Ipo Pending On The Results Of The Final Review, We Will Decide When Will Be The Best Time To Get Listed, The Official Added Although Kurly Filed For The Review Procedure Five Months Ago, The Korea Exchange Had Expressed Concerns About The Possibility Of Its Founder S Dwindling Control Over The Firm Kim Seul Ah, Kurly S Ceo And Founder, Is The Company S Sixth Largest Shareholder With A Tiny 5 75 Percent Stake, While More Than Half The Shares Are Owned By Foreign Investors, Notably Chinese Funds Such As Scc Growth V Holdco H, Ltd And Hh Sum Xi Holdings Limited The Korea Exchange Said The Company Might Face A Series Of Exits From Shareholders Or Hostile Mergers And Acquisitions Because Kim Does Not Hold Enough Shares To Protect Her Management Rights As Per The Bourse Operator S Request, Most Of Kurly S Financial Investors Turned In Affirmation Documents Last Month Stating That They Will Not Sell Their Shares Before 18 Months After The Ipo They Also Promised To Hold A Joint Voting Rights Session When Selling More Than 20 Percent Of Their Shares In Order To Diversify Its Business Portfolio, The Company Has Announced That It Will Launch A Marketplace Service, Acting As An Intermediary Between Home Appliance Providers And Buyers Starting Next Month It Also Recently Began Exporting Ready Made Foods To Singapore But Industry Insiders Say Kurly Might Not Receive A Fair Valuation From The Market, Falling Short Of Its Expected Corporate Value Of Some 4 Trillion Won 5 Trillion Won 3 1 Billion 3 8 Billion Currently It Is Not The Best Timing For An Ipo So I Don T Think Kurly Will Reach 4 Trillion Won In Valuation, Said Seo Yong Ku, A Business Professor At Sookmyung Women S University The Company Will Have To Work Hard To Successfully Make An Appeal To Institutional Investors With Its Value Adding Business Plan Car Sharing Platform Socar, Which Recently Completed Its Book Building Process, Had To Lower Its Ipo Price, Decreasing Its Estimated Corporate Value From 1 Trillion Won To 966 5 Billion Won Rival E Commerce Platforms Such As Ssg Com Have Postponed Their Ipos To Next Year Oasis, Which Said It Plans To Go Public This Year, Has Yet To Start The Process Due To The Ipo Market Downturn By Byun Hye Jin Hyejin2 Heraldcorp Com "," The Korea Exchange, Kurly, The Korea Herald, Kurly, The Korea Exchange, Holdings Limited, The Korea Exchange, Ipo, Sookmyung Women S University, Socar, Ssg Com, Byun Hye Jin , ", ,http://www.koreaherald.com//view.php?ud=20220816000788&ACE_SEARCH=1, , 
