,publish_date,scraped_date,title,text,Companies,Country,link,Comments,update
36,12/Oct/2022 00:00:00,13/Oct/2022 03:45:28,"Bell Potter, Canaccord Seek Bids For Conrad Asia Energy Ipo","Conrad Asia Energy Ltd And Its Stockbrokers Are Trying To Bring The Company S Proposed 45 Million Initial Public Offering To A Head, Calling For Bids By The End Of This Week Broker Bell Potter, A Joint Lead Manager Alongside Canaccord Genuity, Sent Terms Through Its Network On Wednesday, Seeking Bids By 5Pm Thursday Ahead Of The Friday Broker Firm And Institutional Offer Close Conrad Asia Energy Is Raising Funds To Progress Work At Its Mako Gas Field John Woudstra Singapore Registered Conrad Is Seeking To Raise 45 Million At 1 46 A Security, In A Deal That Would Value The Company At 232 7 Million On A Market Capitalisation Basis It Left Room For Another 10 Million In Oversubscriptions, Which Would Take The Offer Size To 55 Million If Successful It Would List On October 26 And Be The Biggest Ipo In Australia This Half The Price Implied 0 38 Times Net Asset Value, The Term Sheet Said, Calculated As Market Capitalisation Divided By The Net Asset Value Of Us442 Million 609 Million "," Conrad Asia Energy Ltd, Bell Potter, Conrad Asia Energy, Mako, Conrad , Bell Potter, Conrad Asia Energy ", ,https://www.afr.com/street-talk/bell-potter-canaccord-seek-bids-for-conrad-asia-energy-ipo-20221012-p5bp6w, , 
37,12/Oct/2022 00:00:00,13/Oct/2022 03:45:28,Electronics Mart India B Ipo B Share Allotment Today Here S How To Check Status Online,Shares Of Electronics Mart Will Be Listed On Nse And Bse On October 17 Those Who Have Bid For The B Ipo B Can Check Their Allo ," Electronics Mart, Bse , ", ,https://www.businesstoday.in/markets/ipo-corner/story/electronics-mart-india-ipo-share-allotment-today-heres-how-to-check-status-online-349627-2022-10-12, , 
38,12/Oct/2022 00:00:00,13/Oct/2022 03:45:28,Solana Defi B Trading B Platform Mango Markets Loses 100M In Hack Decrypt,Mango Markets Is A Solana Based Platform For B Trading B Digital Assets On The Solana Blockchain For Spot Margin And B Trading B Perpetual Futures ," Mango Markets, Solana , Hack Decrypt ", ,https://decrypt.co/111727/solana-defi-trading-platform-mango-markets-loses-100m-in-hack, , 
39,12/Oct/2022 00:00:00,13/Oct/2022 03:45:28,Panthers Fire Sale Nope But Three Players Make Sense On B Trade B Block Before Deadline,Carolina Panthers Fired Head Coach Matt Rhule Monday Many Pundits Assume The Panthers Will Look To B Trade B Assets On Cusp Of Another Rebuild ," , ", ,https://www.charlotteobserver.com/sports/nfl/carolina-panthers/article267138446.html, , 
40,12/Oct/2022 00:00:00,13/Oct/2022 03:45:28,Bitcoin Analysts And B Traders B Say Btc S Low Volatility Is A Calm Before The Storm ,"If You Were To Hang Around Crypto B Traders B This Week, You Would Hear Three Bitcoin Price Has Been B Trading B In The 18,500 24,500 Range For The "," , Btc ", ,https://cointelegraph.com/news/bitcoin-analysts-and-traders-say-btc-s-low-volatility-is-a-calm-before-the-storm, , 
41,12/Oct/2022 00:00:00,13/Oct/2022 03:45:28,Day B Trading B Guide For Today 4 Stocks To Buy Or Sell Today 12Th October Mint,"Day B Trading B Guide For Wednesday The Short Term Trend Of Nifty Remains Weak And The Downside Momentum Has Started To Pick Up From The Lower Highs, "," Nifty , Mint ", ,https://www.livemint.com/market/stock-market-news/day-trading-guide-for-today-4-stocks-to-buy-or-sell-today-12th-october-11665533566630.html, , 
42,12/Oct/2022 00:00:00,13/Oct/2022 03:45:28,4 Carolina Panthers The Detroit Lions Should Have Interest In B Trading B For Sidelion Report,"As The Carolina Panthers Consider B Trading B Players For Picks, The Detroit Lions Should Have These Five On Their Radar To Acquire "," Carolina Panthers, The Detroit Lions , Carolina Panthers, The Detroit Lions ", ,https://sidelionreport.com/2022/10/11/4-carolina-panthers-detroit-lions-interest-trading/, , 
43,12/Oct/2022 00:00:00,13/Oct/2022 03:45:28,Battery Metals B Trade B Sideways As Market Becomes More Competitive Oilprice Com,"Still Recovering From August S Steep Drop, Cobalt B Traded B Sideways Between September 1 And October 1, Then Fell By A Modest 2 03% "," , ", ,https://oilprice.com/Metals/Commodities/Battery-Metals-Trade-Sideways-As-Market-Becomes-More-Competitive.html, , 
44,12/Oct/2022 00:00:00,13/Oct/2022 03:45:28,Five Top Targets Ahead Of 2022 Nfl B Trade B Deadline Nbc Sports Bay Area,"Christian Mccaffrey, Robert Quinn And Kenny Golladay Are Among The Top Potential Targets To Monitor Ahead Of The Nov 1 Nfl B Trade B Deadline "," Nfl , Nfl ", ,https://www.nbcsports.com/bayarea/49ers/five-top-targets-ahead-2022-nfl-trade-deadline, , 
45,12/Oct/2022 00:00:00,13/Oct/2022 03:45:28,Solana Based B Trading B Platform Mango Reportedly Hit By 115 Million Exploit Fortune,"Mango Markets, A Decentralized B Trading B Platform On The Solana Blockchain, Looks To Be The Latest Victim Of A Massive Hack Within The Crypto Realm "," Mango Markets , Solana ", ,https://fortune.com/crypto/2022/10/11/mango-markets-trading-platform-on-solana-seemingly-hit-by-exploit/, , 
46,12/Oct/2022 00:00:00,13/Oct/2022 03:45:28,Denver Broncos Top B Trade B Candidates With Deadline Approaching Sports Illustrated,Here Is A List Of Players That Could Be Potential Midseason B Trade B Candidates And What Is The Likelihood The Player Will Be B Traded B Bradley Chubb Olb ," Bradley Chubb, Olb , ", ,https://www.si.com/nfl/broncos/news/broncos-trade-candidates-bradley-chubb-jerry-jeudy, , 
47,12/Oct/2022 00:00:00,13/Oct/2022 03:45:28,Federal Court Orders Texas Fraudulent Forex Trader And His Company To Pay Over ,"Washington, D C The Commodity Futures B Trading B Commission Today Announced To Be Generated Using Participants Pooled Funds To B Trade B Forex "," Commodity Futures , Federal Court Orders ", ,https://www.cftc.gov/PressRoom/PressReleases/8607-22, , 
48,12/Oct/2022 00:00:00,13/Oct/2022 03:45:28,Federal Officials B Traded B Stocks Affected By Agency Decisions Wsj The Maine Wire,"The Wall Street Journal Reported Tuesday The Results Of A Deep Investigation Into The Stock B Trading B Of Federal Government Officials, Revealing For "," The Wall Street Journal , Wsj ", ,https://www.themainewire.com/2022/10/federal-officials-traded-stocks-affected-by-agency-decisions-wsj/, , 
49,12/Oct/2022 00:00:00,13/Oct/2022 03:45:28,Panthers B Trading B D J Moore To Bears Makes Little Sense For Either Team Nbc Sports,"Given The Bears Lack Of Talent At Wide Receiver After Darnell Mooney, The Internet Began To Speculate The Bears Could B Trade B For Panthers Star "," , D J Moore, Nbc Sports ", ,https://www.nbcsports.com/chicago/bears/panthers-trading-dj-moore-bears-makes-little-sense-either-team, , 
50,12/Oct/2022 00:00:00,13/Oct/2022 03:45:28,Franklin Templeton Puts Hidroelectrica S Single Market Ipo On The Fp Shareholder Meeting Agenda,"Franklin Templeton International, The Manager Of Fondul Proprietatea Fp , Announced It Added A New Point On The Agenda Of Fp S November 15 Shareholder Meeting, Namely The Listing Of The Shares Held By Fp In Hidroelectrica Exclusively On The Local Stock Exchange Bvb As Suggested By The Government Of Romania The Agenda Still Includes The Proposal For The Dual Listing Of Hidroelectricas Shares As Well The Amounts Resulting From The Partial Or Entire Sale Of The Package Of Shares During The Secondary Public Offering Shall Be Distributed To Company S Shareholders As A Special Dividend Within 3 Months Of The Collection Of That Amount By The Company, According To The Proposal Advocated By The Government Fondul Proprietatea Owns Approximately 20% Of The Total Shares Of Hidroelectrica, The Largest Electricity Producer In Romania Among The Shareholders Of Fp Are Private Pension Funds Pilon Ii, The American Group Silver Point Capital And Mutual Funds, And The Romanian Government 5 8% The State Owned Hydropower Producer Hidroelectrica Will Have Its Initial Public Offering By The End Of June 2023 The Date Was Agreed Upon After Talks Between Prime Minister Nicolae Ciuc And Other Representatives Of The Government And A Delegation From Fondul Proprietatea Andrei Romania Insider Com Photo Source Dreamstime Com "," Franklin Templeton International, Fondul Proprietatea, Fp, Fp, The Local Stock Exchange, Bvb, The Government Of Romania, Hidroelectricas, Fp, Silver Point Capital, The Romanian Government , ", ,https://www.romania-insider.com/franklin-templeton-hidroelectrica-ipo-shareholders-agenda, , 
51,12/Oct/2022 00:00:00,13/Oct/2022 03:45:28,Billionaire Enrique Razon S Prime Infra Defers 478 Million Ipo,"Prime Infrastructure Capital Controlled By Billionaire Enrique Razon Jr Said Tuesday It Has Postponed Its Initial Public Offering Until The First Half Of 2023 Due To Unfavorable Market Conditions The Ipo Which Is Being Managed By Clsa As Global Coordinator And Bookrunner, And By Bdo Capital And Bpi Capital As Domestic Underwriters Would Have Been The Philippines Largest Maiden Share Sale This Year Prime Infra Was Aiming To Raise As Much As 28 2 Billion Pesos 478 Million To Bankroll Investments In Renewable Energy And Water Utilities The Decision To Pull The Plug On The Ipo Was Made Last Week, After The Company Held Investor Roadshows In September Across Asia, Europe And The U S , According To Bdo Capital President Eduardo Francisco While Investors Liked The Company, There Were Concerns About The Bearish Market Sentiment And The Peso S Depreciation, He Added Read The Full Story On Forbes Here "," Infrastructure, Clsa, Bdo Capital, Bpi Capital, Bdo Capital, Forbes , Infra ", ,https://www.wealthx.com/intelligence-centre/daily-news/2022/billionaire-enrique-razons-prime-infra-defers-478-million-ipo/, , 
52,12/Oct/2022 00:00:00,13/Oct/2022 03:45:28,Franklin Templeton Puts Hidroeelectrica S Single Market Ipo On The Fp Shareholder Meeting Agenda,"Franklin Templeton International, The Manager Of Fondul Proprietatea Fp , Announced It Added A New Point On The Agenda Of Fp S November 15 Shareholder Meeting, Namely The Listing Of The Shares Held By Fp In Hidroelectrica Exclusively On The Local Stock Exchange Bvb As Suggested By The Government Of Romania The Agenda Still Includes The Proposal For The Dual Listing Of Hidroelectricas Shares As Well The Amounts Resulting From The Partial Or Entire Sale Of The Package Of Shares During The Secondary Public Offering Shall Be Distributed To Company S Shareholders As A Special Dividend Within 3 Months Of The Collection Of That Amount By The Company, According To The Proposal Advocated By The Government Fondul Proprietatea Owns Approximately 20% Of The Total Shares Of Hidroelectrica, The Largest Electricity Producer In Romania Among The Shareholders Of Fp Are Private Pension Funds Pilon Ii, The American Group Silver Point Capital And Mutual Funds, And The Romanian Government 5 8% The State Owned Hydropower Producer Hidroelectrica Will Have Its Initial Public Offering By The End Of June 2023 The Date Was Agreed Upon After Talks Between Prime Minister Nicolae Ciuc And Other Representatives Of The Government And A Delegation From Fondul Proprietatea Andrei Romania Insider Com Photo Source Dreamstime Com "," Franklin Templeton International, Fondul Proprietatea, Fp, The Local Stock Exchange, Bvb, The Government Of Romania, Hidroelectricas, Company S, Company, Fp, Silver Point Capital, The Romanian Government, Dreamstime Com , Hidroeelectrica S ", ,https://www.romania-insider.com/franklin-templeton-hidroelectrica-ipo-shareholders-agenda, , 
53,11/Oct/2022 00:00:00,13/Oct/2022 03:45:28,"Tusimple Shareholder Alert Claimsfiler Reminds Investors With Losses In Excess Of 100,000 Of Lead Plaintiff Deadline In Class Action Lawsuit Against Tusimple Holdings Inc Tsp","New Orleans, Oct 11, 2022 Globe Newswire Claimsfiler, A Free Shareholder Information Service, Reminds Investors That They Have Until October 31, 2022 To File Lead Plaintiff Applications In A Securities Class Action Lawsuit Against Tusimple Holdings Inc Nasdaqgs Tsp , If They Purchased Or Otherwise Acquired The Company S Securities Between April 15, 2021 And August 1, 2022, Inclusive The Class Period And Or Purchased Or Otherwise Acquired The Company S Shares Pursuant To The Company S April 2021 Initial Public Offering The Ipo This Action Is Pending In The United States District Court For The Southern District Of California Get Help Tusimple Investors Should Visit Us At Https Claimsfiler Com Cases Nasdaq Tsp Or Call Toll Free 844 367 9658 Lawyers At Kahn Swick Foti, Llc Are Available To Discuss Your Legal Options About The Lawsuit Tusimple And Certain Of Its Executives Are Charged With Failing To Disclose Material Information During The Class Period And Or In The Registration Statement And Prospectus Issued In Conjunction With The Initial Public Offering, Violating Federal Securities Laws The Alleged False And Misleading Statements And Omissions Include, But Are Not Limited To, That I The Company Had Significantly Overstated Its Commitment To Safety And Concealed Fundamental Problems With Its Technology Ii The Company Was Rushing The Testing Of Its Autonomous Driving Technology In Order To Deliver Driverless Trucks To The Market Ahead Of Its More Safety Conscious Competitors Iii The Company S Corporate Culture Suppressed Or Ignored Safety Concerns In Favor Of Unrealistically Ambitious Testing And Delivery Schedules Iv The Aforementioned Conduct Made Accidents Involving The Company S Autonomous Driving Technology More Likely V The Aforementioned Conduct Was Likely To Lead To Enhanced Regulatory Scrutiny And Investigatory Action Toward The Company And Iv As A Result, The Company S Public Statements Were Materially False And Misleading At All Relevant Times The Case Is Dicker V Tusimple Holdings, Inc , No 22 Cv 01300 About Claimsfiler Claimsfiler Has A Single Mission To Serve As The Information Source To Help Retail Investors Recover Their Share Of Billions Of Dollars From Securities Class Action Settlements At Claimsfiler Com, Investors Can 1 Register For Free To Gain Access To Information And Settlement Websites For Various Securities Class Action Cases So They Can Timely Submit Their Own Claims 2 Upload Their Portfolio Transactional Data To Be Notified About Relevant Securities Cases In Which They May Have A Financial Interest And 3 Submit Inquiries To The Kahn Swick Foti, Llc Law Firm For Free Case Evaluations To Learn More About Claimsfiler, Visit Www Claimsfiler Com "," Globe Newswire, Free, Tusimple Holdings Inc , Company, Kahn Swick Foti, The Registration Statement, Prospectus, Company, Tusimple Holdings, Inc , Claimsfiler, Claimsfiler, Claimsfiler Com, The Kahn Swick Foti, Claimsfiler , ", ,https://www.globenewswire.com/news-release/2022/10/12/2532461/35454/en/TUSIMPLE-SHAREHOLDER-ALERT-CLAIMSFILER-REMINDS-INVESTORS-WITH-LOSSES-IN-EXCESS-OF-100-000-of-Lead-Plaintiff-Deadline-in-Class-Action-Lawsuit-Against-TuSimple-Holdings-Inc-TSP.html, , 
54,11/Oct/2022 00:00:00,13/Oct/2022 03:45:28,"Dingdong Shareholder Alert Claimsfiler Reminds Investors With Losses In Excess Of 100,000 Of Lead Plaintiff Deadline In Class Action Lawsuit Against Dingdong Cayman Limited Ddl","New Orleans, Oct 11, 2022 Globe Newswire Claimsfiler, A Free Shareholder Information Service, Reminds Investors That They Have Until October 24, 2022 To File Lead Plaintiff Applications In A Securities Class Action Lawsuit Against Dingdong Cayman Limited Nyse Ddl , If They Purchased Or Acquired The Company S American Depository Shares Ads Pursuant And Or Traceable To The Company S June 2021 Initial Public Offering The Ipo This Action Is Pending In The United States District Court For The Southern District Of New York Get Help Dingdong Investors Should Visit Us At Https Claimsfiler Com Cases Nyse Ddl Or Call Toll Free 844 367 9658 Lawyers At Kahn Swick Foti, Llc Are Available To Discuss Your Legal Options About The Lawsuit Dingdong And Certain Of Its Executives Are Charged With Failing To Disclose Material Information In Its Ipo Registration Statement, Violating Federal Securities Laws The Alleged False And Misleading Statements And Omissions Include, But Are Not Limited To, That I The Company Was Disregarding Food Safety Responsibilities, Failing To Deliver On Its Stated Commitment To Provide Fresh Groceries To Customers Ii The Company S Quality Control Measures Were Inadequate, Exposing It To An Increased Risk Of Regulatory And Or Governmental Scrutiny And Enforcement And Iii As A Result Of The Foregoing, The Company S Registration Statement Was Materially False And Misleading At All Relevant Times The Case Is Mccormack V Dingdong Cayman Ltd , Et Al, No 22 Cv 7273 About Claimsfiler Claimsfiler Has A Single Mission To Serve As The Information Source To Help Retail Investors Recover Their Share Of Billions Of Dollars From Securities Class Action Settlements At Claimsfiler Com, Investors Can 1 Register For Free To Gain Access To Information And Settlement Websites For Various Securities Class Action Cases So They Can Timely Submit Their Own Claims 2 Upload Their Portfolio Transactional Data To Be Notified About Relevant Securities Cases In Which They May Have A Financial Interest And 3 Submit Inquiries To The Kahn Swick Foti, Llc Law Firm For Free Case Evaluations To Learn More About Claimsfiler, Visit Www Claimsfiler Com "," Globe Newswire, Free, Nyse, Company S American Depository Shares, Kahn Swick Foti, Ipo Registration Statement, Cayman Ltd , Claimsfiler, Claimsfiler, Claimsfiler Com, The Kahn Swick Foti, Claimsfiler , ", ,https://www.globenewswire.com/news-release/2022/10/12/2532454/35454/en/DINGDONG-SHAREHOLDER-ALERT-CLAIMSFILER-REMINDS-INVESTORS-WITH-LOSSES-IN-EXCESS-OF-100-000-of-Lead-Plaintiff-Deadline-in-Class-Action-Lawsuit-Against-Dingdong-Cayman-Limited-DDL.html, , 
55,11/Oct/2022 00:00:00,13/Oct/2022 03:45:28,"Centessa Pharmaceuticals Shareholder Alert Claimsfiler Reminds Investors With Losses In Excess Of 100,000 Of Lead Plaintiff Deadline In Class Action Lawsuit Against Centessa Pharmaceuticals Plc Cnta","New Orleans, Oct 11, 2022 Globe Newswire Claimsfiler, A Free Shareholder Information Service, Reminds Investors That They Have Until November 28, 2022 To File Lead Plaintiff Applications In A Securities Class Action Lawsuit Against Centessa Pharmaceuticals Plc Nasdaqgs Cnta , If They Purchased Or Otherwise Acquired The Company S Securities Between May 28, 2021 And June 1, 2022, Inclusive The Class Period And Or Purchased Or Otherwise Acquired The Company S American Depositary Shares Adss Pursuant To The Company S May 2021 Initial Public Offering The Ipo This Action Is Pending In The United States District Court For The Central District Of California Get Help Centessa Investors Should Visit Us At Https Claimsfiler Com Cases Nasdaq Cnta Or Call Toll Free 844 367 9658 Lawyers At Kahn Swick Foti, Llc Are Available To Discuss Your Legal Options About The Lawsuit Centessa And Certain Of Its Executives Are Charged With Failing To Disclose Material Information During The Class Period And Or In The Registration Statement And Prospectus Issued In Conjunction With The Initial Public Offering, Violating Federal Securities Laws The Alleged False And Misleading Statements And Omissions Include, But Are Not Limited To, That I Lixivaptan, The Company S Drug Product, Was Less Safe Than The Company Had Represented Ii The Company Overstated Lixivaptan S Clinical Effectiveness And Commercial Viability Iii Zf874, Another Of The Company S Drug Products, Was Less Safe Than The Company Had Represented Iv The Company Overstated Zf874 S Clinical Effectiveness And Commercial Viability While Downplaying The Drug S Safety Issues And V As A Result, The Company S Public Statements Were Materially False And Misleading At All Relevant Times The Case Is Fernandes V Centessa Pharmaceuticals Plc, Et Al , No 22 Cv 07030 About Claimsfiler Claimsfiler Has A Single Mission To Serve As The Information Source To Help Retail Investors Recover Their Share Of Billions Of Dollars From Securities Class Action Settlements At Claimsfiler Com, Investors Can 1 Register For Free To Gain Access To Information And Settlement Websites For Various Securities Class Action Cases So They Can Timely Submit Their Own Claims 2 Upload Their Portfolio Transactional Data To Be Notified About Relevant Securities Cases In Which They May Have A Financial Interest And 3 Submit Inquiries To The Kahn Swick Foti, Llc Law Firm For Free Case Evaluations To Learn More About Claimsfiler, Visit Www Claimsfiler Com "," Globe Newswire, Free, Centessa Pharmaceuticals Plc, Company, Company S, Kahn Swick Foti, The Registration Statement, Prospectus, Company, Company, Zf874, Zf874, Company, Centessa Pharmaceuticals Plc, Claimsfiler, Claimsfiler Com, The Kahn Swick Foti, Claimsfiler , ", ,https://www.globenewswire.com/news-release/2022/10/12/2532455/35454/en/CENTESSA-PHARMACEUTICALS-SHAREHOLDER-ALERT-CLAIMSFILER-REMINDS-INVESTORS-WITH-LOSSES-IN-EXCESS-OF-100-000-of-Lead-Plaintiff-Deadline-in-Class-Action-Lawsuit-Against-Centessa-Pharma.html, , 
